{
  "layout_schema_version": 2,
  "layout_algorithm_version": "persistent-geography-2",
  "generation": 0,
  "reserve": 0.4,
  "gap": 32,
  "level": 900,
  "categories": {
    "category:1162": {
      "category_id": "category:1162",
      "parent_id": null,
      "sibling_order": 0,
      "anchor": 14362.399999999998,
      "width": 28724.799999999996,
      "reserved_capacity": 0,
      "growth_limit_width": 57449.59999999999,
      "topicStart": 0,
      "topicRowOffset": 2,
      "children": {
        "category:1163": {
          "left": 0,
          "width": 5930.4
        },
        "category:1164": {
          "left": 5962.4,
          "width": 22114.399999999998
        },
        "category:2679": {
          "left": 28108.799999999996,
          "width": 616
        }
      }
    },
    "category:1163": {
      "category_id": "category:1163",
      "parent_id": "category:1162",
      "sibling_order": 0,
      "anchor": 2933.2,
      "width": 5930.4,
      "reserved_capacity": 64,
      "growth_limit_width": 17930.4,
      "topicStart": 0,
      "topicRowOffset": 2,
      "children": {
        "category:126": {
          "left": 0,
          "width": 1008
        },
        "category:258": {
          "left": 1040,
          "width": 2899.2
        },
        "category:357": {
          "left": 3971.2,
          "width": 1895.1999999999998
        }
      }
    },
    "category:1164": {
      "category_id": "category:1164",
      "parent_id": "category:1162",
      "sibling_order": 1,
      "anchor": 11037.999999999998,
      "width": 22114.399999999998,
      "reserved_capacity": 38.400000000001455,
      "growth_limit_width": 66343.2,
      "topicStart": 0,
      "topicRowOffset": 2,
      "children": {
        "category:73": {
          "left": 0,
          "width": 22075.999999999996
        }
      }
    },
    "category:1186": {
      "category_id": "category:1186",
      "parent_id": "category:357",
      "sibling_order": 1,
      "anchor": 330,
      "width": 923.9999999999999,
      "reserved_capacity": 263.9999999999999,
      "growth_limit_width": 12924,
      "topicStart": 0,
      "topicRowOffset": 2,
      "children": {
        "category:516": {
          "left": 0,
          "width": 660
        }
      }
    },
    "category:1188": {
      "category_id": "category:1188",
      "parent_id": "category:357",
      "sibling_order": 2,
      "anchor": 108,
      "width": 302.4,
      "reserved_capacity": 86.39999999999998,
      "growth_limit_width": 12302.4,
      "topicStart": 0,
      "topicRowOffset": 2,
      "children": {
        "category:679": {
          "left": 0,
          "width": 216
        }
      }
    },
    "category:1215": {
      "category_id": "category:1215",
      "parent_id": "category:73",
      "sibling_order": 1,
      "anchor": 442,
      "width": 1237.6,
      "reserved_capacity": 353.5999999999999,
      "growth_limit_width": 13237.6,
      "topicStart": 0,
      "topicRowOffset": 2,
      "children": {
        "category:187": {
          "left": 0,
          "width": 884
        }
      }
    },
    "category:1258": {
      "category_id": "category:1258",
      "parent_id": "category:73",
      "sibling_order": 2,
      "anchor": 3179,
      "width": 8901.199999999999,
      "reserved_capacity": 2543.199999999999,
      "growth_limit_width": 26703.6,
      "topicStart": 0,
      "topicRowOffset": 2,
      "children": {
        "category:196": {
          "left": 1368,
          "width": 668
        },
        "category:251": {
          "left": 2068,
          "width": 4290
        },
        "category:95": {
          "left": 0,
          "width": 1336
        }
      }
    },
    "category:126": {
      "category_id": "category:126",
      "parent_id": "category:1163",
      "sibling_order": 0,
      "anchor": 504,
      "width": 1008,
      "reserved_capacity": 0,
      "growth_limit_width": 13008,
      "topicStart": 0,
      "topicRowOffset": 2,
      "children": {
        "category:2944": {
          "left": 0,
          "width": 1007.9999999999999
        }
      }
    },
    "category:1260": {
      "category_id": "category:1260",
      "parent_id": "category:73",
      "sibling_order": 3,
      "anchor": 887,
      "width": 2483.6,
      "reserved_capacity": 709.5999999999999,
      "growth_limit_width": 14483.6,
      "topicStart": 0,
      "topicRowOffset": 2,
      "children": {
        "category:1423": {
          "left": 1138,
          "width": 636
        },
        "category:61": {
          "left": 0,
          "width": 1106
        }
      }
    },
    "category:1262": {
      "category_id": "category:1262",
      "parent_id": "category:13",
      "sibling_order": 0,
      "anchor": 780,
      "width": 1560,
      "reserved_capacity": 0,
      "growth_limit_width": 13560,
      "topicStart": 0,
      "topicRowOffset": 0,
      "children": {}
    },
    "category:1263": {
      "category_id": "category:1263",
      "parent_id": "category:13",
      "sibling_order": 1,
      "anchor": 317,
      "width": 634,
      "reserved_capacity": 0,
      "growth_limit_width": 12634,
      "topicStart": 0,
      "topicRowOffset": 0,
      "children": {}
    },
    "category:1264": {
      "category_id": "category:1264",
      "parent_id": "category:195",
      "sibling_order": 0,
      "anchor": 318,
      "width": 636,
      "reserved_capacity": 0,
      "growth_limit_width": 12636,
      "topicStart": 0,
      "topicRowOffset": 0,
      "children": {}
    },
    "category:1265": {
      "category_id": "category:1265",
      "parent_id": "category:195",
      "sibling_order": 1,
      "anchor": 317,
      "width": 634,
      "reserved_capacity": 0,
      "growth_limit_width": 12634,
      "topicStart": 0,
      "topicRowOffset": 0,
      "children": {}
    },
    "category:1267": {
      "category_id": "category:1267",
      "parent_id": "category:195",
      "sibling_order": 2,
      "anchor": 105,
      "width": 210,
      "reserved_capacity": 0,
      "growth_limit_width": 12210,
      "topicStart": 0,
      "topicRowOffset": 0,
      "children": {}
    },
    "category:1268": {
      "category_id": "category:1268",
      "parent_id": "category:251",
      "sibling_order": 2,
      "anchor": 228,
      "width": 456,
      "reserved_capacity": 0,
      "growth_limit_width": 12456,
      "topicStart": 0,
      "topicRowOffset": 2,
      "children": {
        "category:1269": {
          "left": 0,
          "width": 456
        }
      }
    },
    "category:1269": {
      "category_id": "category:1269",
      "parent_id": "category:1268",
      "sibling_order": 0,
      "anchor": 228,
      "width": 456,
      "reserved_capacity": 0,
      "growth_limit_width": 12456,
      "topicStart": 0,
      "topicRowOffset": 0,
      "children": {}
    },
    "category:13": {
      "category_id": "category:13",
      "parent_id": "category:251",
      "sibling_order": 0,
      "anchor": 1113,
      "width": 2226,
      "reserved_capacity": 0,
      "growth_limit_width": 14226,
      "topicStart": 0,
      "topicRowOffset": 2,
      "children": {
        "category:1262": {
          "left": 0,
          "width": 1560
        },
        "category:1263": {
          "left": 1592,
          "width": 634
        }
      }
    },
    "category:1356": {
      "category_id": "category:1356",
      "parent_id": "category:477",
      "sibling_order": 0,
      "anchor": 220,
      "width": 616,
      "reserved_capacity": 176,
      "growth_limit_width": 12616,
      "topicStart": 0,
      "topicRowOffset": 0,
      "children": {}
    },
    "category:1423": {
      "category_id": "category:1423",
      "parent_id": "category:1260",
      "sibling_order": 1,
      "anchor": 318,
      "width": 636,
      "reserved_capacity": 0,
      "growth_limit_width": 12636,
      "topicStart": 0,
      "topicRowOffset": 0,
      "children": {}
    },
    "category:1432": {
      "category_id": "category:1432",
      "parent_id": "category:850",
      "sibling_order": 0,
      "anchor": 105,
      "width": 210,
      "reserved_capacity": 0,
      "growth_limit_width": 12210,
      "topicStart": 0,
      "topicRowOffset": 0,
      "children": {}
    },
    "category:153": {
      "category_id": "category:153",
      "parent_id": "category:252",
      "sibling_order": 3,
      "anchor": 330,
      "width": 660,
      "reserved_capacity": 0,
      "growth_limit_width": 12660,
      "topicStart": 0,
      "topicRowOffset": 0,
      "children": {}
    },
    "category:187": {
      "category_id": "category:187",
      "parent_id": "category:1215",
      "sibling_order": 0,
      "anchor": 442,
      "width": 884,
      "reserved_capacity": 0,
      "growth_limit_width": 12884,
      "topicStart": 0,
      "topicRowOffset": 0,
      "children": {}
    },
    "category:188": {
      "category_id": "category:188",
      "parent_id": "category:252",
      "sibling_order": 4,
      "anchor": 317,
      "width": 634,
      "reserved_capacity": 0,
      "growth_limit_width": 12634,
      "topicStart": 0,
      "topicRowOffset": 0,
      "children": {}
    },
    "category:195": {
      "category_id": "category:195",
      "parent_id": "category:251",
      "sibling_order": 1,
      "anchor": 772,
      "width": 1544,
      "reserved_capacity": 0,
      "growth_limit_width": 13544,
      "topicStart": 0,
      "topicRowOffset": 2,
      "children": {
        "category:1264": {
          "left": 0,
          "width": 636
        },
        "category:1265": {
          "left": 668,
          "width": 634
        },
        "category:1267": {
          "left": 1334,
          "width": 210
        }
      }
    },
    "category:196": {
      "category_id": "category:196",
      "parent_id": "category:1258",
      "sibling_order": 1,
      "anchor": 334,
      "width": 668,
      "reserved_capacity": 0,
      "growth_limit_width": 12668,
      "topicStart": 0,
      "topicRowOffset": 0,